{"$defs":{"DatasetCounts":{"additionalProperties":false,"description":"Population and event counts of a dataset build.","properties":{"distinct_ids":{"title":"Distinct Ids","type":"integer"},"events":{"title":"Events","type":"integer"},"internal_users":{"title":"Internal Users","type":"integer"},"planted_journeys":{"title":"Planted Journeys","type":"integer"},"users":{"title":"Users","type":"integer"},"visitors":{"title":"Visitors","type":"integer"}},"required":["events","users","internal_users","visitors","planted_journeys","distinct_ids"],"title":"DatasetCounts","type":"object"},"DateWindow":{"additionalProperties":false,"description":"An inclusive local date range.","properties":{"date_from":{"format":"date","title":"Date From","type":"string"},"date_to":{"format":"date","title":"Date To","type":"string"}},"required":["date_from","date_to"],"title":"DateWindow","type":"object"},"FileEntry":{"additionalProperties":false,"description":"Hash and size of one dataset file.","properties":{"bytes":{"title":"Bytes","type":"integer"},"lines":{"anyOf":[{"type":"integer"},{"type":"null"}],"default":null,"title":"Lines"},"sha256":{"pattern":"^[0-9a-f]{64}$","title":"Sha256","type":"string"}},"required":["sha256","bytes"],"title":"FileEntry","type":"object"},"ProjectConfig":{"additionalProperties":false,"description":"Project configuration the oracle evaluates against (§6.1).","properties":{"test_account_filters":{"items":{"$ref":"#/$defs/TestAccountFilter"},"title":"Test Account Filters","type":"array"},"timezone":{"title":"Timezone","type":"string"},"week_start_day":{"enum":[0,1],"title":"Week Start Day","type":"integer"}},"required":["timezone","week_start_day","test_account_filters"],"title":"ProjectConfig","type":"object"},"TestAccountFilter":{"additionalProperties":false,"description":"The project test-account filter of contract §4.2.","properties":{"key":{"title":"Key","type":"string"},"operator":{"const":"not_icontains","title":"Operator","type":"string"},"type":{"const":"person","title":"Type","type":"string"},"value":{"title":"Value","type":"string"}},"required":["key","type","value","operator"],"title":"TestAccountFilter","type":"object"}},"$id":"https://agenttruth.dev/schemas/manifest.v1.json","$schema":"https://json-schema.org/draft/2020-12/schema","additionalProperties":false,"description":"``manifest.json`` of a dataset build (§5.1).","properties":{"catalog_sha256":{"anyOf":[{"pattern":"^[0-9a-f]{64}$","type":"string"},{"type":"null"}],"title":"Catalog Sha256"},"counts":{"$ref":"#/$defs/DatasetCounts"},"dataset_id":{"title":"Dataset Id","type":"string"},"faults_disabled":{"items":{"enum":["F1","F2","F3","F4","F5"],"type":"string"},"title":"Faults Disabled","type":"array"},"faults_enabled":{"items":{"enum":["F1","F2","F3","F4","F5"],"type":"string"},"title":"Faults Enabled","type":"array"},"files":{"additionalProperties":{"$ref":"#/$defs/FileEntry"},"title":"Files","type":"object"},"generator_version":{"title":"Generator Version","type":"string"},"project_config":{"$ref":"#/$defs/ProjectConfig"},"schema":{"const":"agenttruth.manifest/v1","title":"Schema","type":"string"},"seed":{"title":"Seed","type":"string"},"spec_sha256":{"pattern":"^[0-9a-f]{64}$","title":"Spec Sha256","type":"string"},"warmup":{"anyOf":[{"$ref":"#/$defs/DateWindow"},{"type":"null"}]},"window":{"$ref":"#/$defs/DateWindow"}},"required":["schema","dataset_id","generator_version","spec_sha256","catalog_sha256","seed","window","warmup","faults_enabled","faults_disabled","project_config","counts","files"],"title":"Manifest","type":"object"}
