{"catalog_sha256":"f2e26062445a7377c2dd07c7b88ea2a56881d8795468bb5bb854f0f8934543d5","counts":{"distinct_ids":7840,"events":82392,"internal_users":40,"planted_journeys":55,"users":2400,"visitors":3000},"dataset_id":"ds1","faults_disabled":[],"faults_enabled":["F1","F2","F3","F4","F5"],"files":{"events.jsonl":{"bytes":29985201,"lines":82392,"sha256":"a33149eb4e79788b7384ae51b4643406270dd3bf9ca2d8027bd17bb8eb3ad7d6"},"ledger.json":{"bytes":13218492,"lines":null,"sha256":"8e15c7c11381a29bf62a0436bd563c34c3b92ecb18be47c549e09e25366424cd"}},"generator_version":"agenttruth-gen/1","project_config":{"test_account_filters":[{"key":"email","operator":"not_icontains","type":"person","value":"@hedgebox-internal.example"}],"timezone":"America/Mexico_City","week_start_day":1},"schema":"agenttruth.manifest/v1","seed":"agenttruth-ds1-v1","spec_sha256":"394c1727a448900178dbb4ee70d8c0da9f8f9a515dbbf2be840f3f281850931b","warmup":{"date_from":"2026-05-18","date_to":"2026-05-31"},"window":{"date_from":"2026-06-01","date_to":"2026-08-31"}}
