{"catalog_sha256":null,"counts":{"distinct_ids":906,"events":3881,"internal_users":6,"planted_journeys":16,"users":300,"visitors":300},"dataset_id":"ds0","faults_disabled":[],"faults_enabled":[],"files":{"events.jsonl":{"bytes":1424334,"lines":3881,"sha256":"28a649786b258926409f8f5ea8f56d81522df6925b6c216686862f38f9ee55e7"},"ledger.json":{"bytes":711043,"lines":null,"sha256":"e09834099cf220d3fb7744db366c0bd65be0717704cf60c86c618ea194f7f236"}},"generator_version":"agenttruth-gen/1","project_config":{"test_account_filters":[{"key":"email","operator":"not_icontains","type":"person","value":"@hedgebox-internal.example"}],"timezone":"America/Mexico_City","week_start_day":1},"schema":"agenttruth.manifest/v1","seed":"agenttruth-ds0-v1","spec_sha256":"25308bba39f58c106869537a12198fd0492ed18d746238f94dcffdb898cca6dd","warmup":{"date_from":"2026-05-01","date_to":"2026-05-03"},"window":{"date_from":"2026-05-04","date_to":"2026-05-10"}}
